<?xml version="1.0" encoding="ISO-8859-1" ?>
<xs:schema xmlns:xs="http://www.w3.org/2001/XMLSchema" 
  xmlns="http://www.w3school.com.cn" elementFormDefault="qualified">
  <xs:element name="MemberList">
    <xs:complexType>
      <xs:attribute name="ListName" type="xs:string"/>
      <xs:sequence>
        <xs:element name="ListMaker" type="xs:string" maxOccurs="1"/>
        <xs:element name="Member" maxOccurs="unbounded">
          <xs:complexType>
            <xs:sequence>
              <xs:element name="Name" type="xs:string" maxOccurs="1"/>
              <xs:element name="Age" maxOccurs="1">
                <xs:simpleType>
                  <xs:restriction base="xs:integer">
                    <xs:minInclusive value="0"/>
                  </xs:restriction>
                </xs:simpleType>
              </xs:element>
              <xs:element name="Birthday" type="xs:date" maxOccurs="1"/>
              <xs:element name="Gender" maxOccurs="1">
                <xs:simpleType>
                  <xs:restriction base="xs:string">
                    <xs:enumeration value="Male"/>
                    <xs:enumeration value="Female"/>
                  </xs:restriction>
                </xs:simpleType>
              </xs:element>
            </xs:sequence>
          </xs:complexType>
        </xs:element>
        <xs:element name="MemberCount" maxOccurs="1">
          <xs:complexType>
            <xs:sequence>
              <xs:element name="All" maxOccurs="1">
                <xs:simpleType>
                  <xs:restriction base="xs:integer">
                    <xs:minInclusive value="0"/>
                  </xs:restriction>
                </xs:simpleType>
              </xs:element>
              <xs:element name="Male" maxOccurs="1">
                <xs:simpleType>
                  <xs:restriction base="xs:integer">
                    <xs:minInclusive value="0"/>
                  </xs:restriction>
                </xs:simpleType>
              </xs:element>
              <xs:element name="Female" maxOccurs="1">
                <xs:simpleType>
                  <xs:restriction base="xs:integer">
                    <xs:minInclusive value="0"/>
                  </xs:restriction>
                </xs:simpleType>
              </xs:element>
            </xs:sequence>
          </xs:complexType>
        </xs:element>
        <xs:element name="ListDate" type="xs:date" maxOccurs="1"/>
      </xs:sequence>
    </xs:complexType>
  </xs:element>
</xs:schema>